{
  "schema": "gridspec.conformance-baseline/v1",
  "module": "github.com/promisegrid/gridspec",
  "implementation": "gridspec-go",
  "spec_digest": "sha256:4f9c77e9ad46430e470f7fca1db5357e055dd4fa7da05fa59219e0e690a748a6",
  "evidence": {
    "command": [
      "gridspec.qualification.smoke.done",
      "gridspec.qualification.smoke.flow",
      "gridspec.qualification.smoke.start",
      "scenario.gridspec.qualification.smoke"
    ],
    "go_test": [
      "scenario.clean.load",
      "scenario.clean.report",
      "scenario.clean.request",
      "scenario.clean.result",
      "scenario.clean.validate",
      "scenario.config.load",
      "scenario.config.request",
      "scenario.config.result",
      "scenario.config.stderr",
      "scenario.conform.compare.coverage",
      "scenario.conform.execute.scenarios",
      "scenario.conform.request",
      "scenario.conform.resolve.bindings",
      "scenario.conform.result",
      "scenario.conform.validate.spec",
      "scenario.emit.request",
      "scenario.emit.result",
      "scenario.emit.retain",
      "scenario.emit.seal",
      "scenario.emit.write",
      "scenario.findings.diagnose",
      "scenario.findings.parse",
      "scenario.findings.report",
      "scenario.findings.request",
      "scenario.findings.result",
      "scenario.flow.clean.load.validate",
      "scenario.flow.clean.report.result",
      "scenario.flow.clean.request.load",
      "scenario.flow.clean.validate.report",
      "scenario.flow.config.load.stderr",
      "scenario.flow.config.request.load",
      "scenario.flow.config.stderr.result",
      "scenario.flow.conform.bind.execute",
      "scenario.flow.conform.compare.result",
      "scenario.flow.conform.execute.compare",
      "scenario.flow.conform.request.validate",
      "scenario.flow.conform.validate.bind",
      "scenario.flow.emit.request.seal",
      "scenario.flow.emit.retain.result",
      "scenario.flow.emit.seal.write",
      "scenario.flow.emit.write.retain",
      "scenario.flow.findings.diagnose.report",
      "scenario.flow.findings.parse.diagnose",
      "scenario.flow.findings.report.result",
      "scenario.flow.findings.request.parse",
      "scenario.flow.inconclusive.diagnose.result",
      "scenario.flow.inconclusive.exhaust.diagnose",
      "scenario.flow.inconclusive.explore.exhaust",
      "scenario.flow.inconclusive.request.explore",
      "scenario.flow.repeat.compare.result",
      "scenario.flow.repeat.first.second",
      "scenario.flow.repeat.request.first",
      "scenario.flow.repeat.second.compare",
      "scenario.inconclusive.diagnose",
      "scenario.inconclusive.exhaust",
      "scenario.inconclusive.explore",
      "scenario.inconclusive.request",
      "scenario.inconclusive.result",
      "scenario.repeat.compare",
      "scenario.repeat.first",
      "scenario.repeat.request",
      "scenario.repeat.result",
      "scenario.repeat.second",
      "scenario.specdot.clean",
      "scenario.specdot.config_failure",
      "scenario.specdot.conform.clean",
      "scenario.specdot.emit_failure",
      "scenario.specdot.findings",
      "scenario.specdot.repeat",
      "scenario.specdot.required_inconclusive"
    ],
    "static": [
      "checker.analyze.liveness",
      "checker.build.shortest.trace",
      "checker.classify.assumed",
      "checker.classify.inconclusive",
      "checker.classify.passed",
      "checker.classify.unchecked",
      "checker.classify.violated",
      "checker.collect.run",
      "checker.enumerate.machines",
      "checker.explore.bfs",
      "checker.initialize.configuration",
      "checker.input.ir",
      "checker.output.runs",
      "checker.supported.semantics",
      "conform.build.artifacts",
      "conform.check.coverage",
      "conform.collect.evidence",
      "conform.compare.baseline",
      "conform.load.sidecar",
      "conform.request",
      "conform.resolve.symbols",
      "conform.result.clean",
      "conform.result.failure",
      "conform.result.mismatch",
      "conform.run.scenarios",
      "conform.vet.specification",
      "conform.write.report",
      "effect.specdot.execute.implementation",
      "effect.specdot.probe.remote",
      "effect.specdot.read.implementation",
      "effect.specdot.read.module",
      "effect.specdot.replace.baseline",
      "effect.specdot.replace.ir",
      "effect.specdot.write.report",
      "graph.gridspec.authority",
      "graph.gridspec.describe",
      "graph.gridspec.qualification",
      "graph.specdot.checker",
      "graph.specdot.conform",
      "graph.specdot.data",
      "graph.specdot.effects",
      "graph.specdot.interfaces",
      "graph.specdot.vet",
      "gridspec.acceptance.decision",
      "gridspec.derived.outputs",
      "gridspec.describe.accepted",
      "gridspec.describe.audit",
      "gridspec.describe.complete",
      "gridspec.describe.failure",
      "gridspec.describe.noop",
      "gridspec.describe.proposal",
      "gridspec.describe.request",
      "gridspec.describe.select",
      "gridspec.describe.transaction",
      "gridspec.describe.validate",
      "gridspec.materialized.state",
      "gridspec.proposal",
      "gridspec.qualification.accepted",
      "gridspec.qualification.available",
      "gridspec.qualification.command",
      "gridspec.qualification.flow.accepted.available",
      "gridspec.qualification.flow.available.generate",
      "gridspec.qualification.flow.available.propose",
      "gridspec.qualification.flow.command.passed",
      "gridspec.qualification.flow.command.reject",
      "gridspec.qualification.flow.generate.gotest",
      "gridspec.qualification.flow.gotest.command",
      "gridspec.qualification.flow.gotest.reject",
      "gridspec.qualification.flow.passed.publish",
      "gridspec.qualification.flow.passed.reject",
      "gridspec.qualification.flow.propose.stop",
      "gridspec.qualification.generate",
      "gridspec.qualification.gotest",
      "gridspec.qualification.passed",
      "gridspec.qualification.propose",
      "gridspec.qualification.publish",
      "gridspec.qualification.reject",
      "gridspec.qualification.stop",
      "gridspec.rejected",
      "gridspec.replay",
      "gridspec.signed.commit",
      "gridspec.transaction",
      "gridspec.vet",
      "machine.specdot.vet",
      "resource.conformance.baseline",
      "resource.go.module",
      "resource.implementation.sidecar",
      "resource.ir.output",
      "resource.remote.markdown",
      "resource.report.stream",
      "resource.spec.module",
      "type.canonical.ir",
      "type.check.run",
      "type.conform.request",
      "type.conform.result",
      "type.conformance.baseline",
      "type.conformance.report",
      "type.conformance.trace.event",
      "type.diagnostic",
      "type.implementation.sidecar",
      "type.ir.binding",
      "type.ir.contract",
      "type.ir.graph",
      "type.source",
      "type.vet.request",
      "type.vet.result",
      "vet.compile.ir",
      "vet.discover.sources",
      "vet.emit.ir",
      "vet.emit.requested",
      "vet.has.errors",
      "vet.load.config",
      "vet.parse.sources",
      "vet.request",
      "vet.resolve.manifest",
      "vet.result.clean",
      "vet.result.failure",
      "vet.result.findings",
      "vet.run.checker",
      "vet.run.rules",
      "vet.seal.ir",
      "vet.select.profile",
      "vet.write.report"
    ],
    "trace": []
  },
  "exclusions": [
    "agent.operator",
    "agent.specdot",
    "decision.bootstrap.authority",
    "decision.bootstrap.conformance",
    "decision.bootstrap.future_build",
    "decision.bootstrap.go",
    "decision.bootstrap.self_spec",
    "decision.edge.bootstrap.conformance",
    "decision.edge.bootstrap.dogfood",
    "decision.edge.bootstrap.generation",
    "decision.edge.bootstrap.implementation",
    "decision.specdot.bootstrap",
    "flow.checker.assumed.collect",
    "flow.checker.bound",
    "flow.checker.collect.done",
    "flow.checker.collect.more",
    "flow.checker.inconclusive.collect",
    "flow.checker.initialize.support",
    "flow.checker.input.enumerate",
    "flow.checker.liveness.assumed",
    "flow.checker.liveness.passed",
    "flow.checker.liveness.violation",
    "flow.checker.machine",
    "flow.checker.none",
    "flow.checker.passed.collect",
    "flow.checker.safety.complete",
    "flow.checker.safety.violation",
    "flow.checker.supported",
    "flow.checker.trace.violated",
    "flow.checker.unchecked.output",
    "flow.checker.unsupported",
    "flow.checker.violated.collect",
    "flow.conform.artifacts.built",
    "flow.conform.artifacts.failure",
    "flow.conform.baseline.matched",
    "flow.conform.baseline.regressed",
    "flow.conform.coverage.met",
    "flow.conform.coverage.missing",
    "flow.conform.evidence.coverage",
    "flow.conform.report.clean",
    "flow.conform.report.failure",
    "flow.conform.request.sidecar",
    "flow.conform.scenarios.failed",
    "flow.conform.scenarios.passed",
    "flow.conform.sidecar.failure",
    "flow.conform.sidecar.loaded",
    "flow.conform.symbols.mismatch",
    "flow.conform.symbols.resolved",
    "flow.conform.vet.clean",
    "flow.conform.vet.findings",
    "flow.vet.checker.seal",
    "flow.vet.compile.rules",
    "flow.vet.config.failure",
    "flow.vet.config.loaded",
    "flow.vet.discovery.failure",
    "flow.vet.emit.failure",
    "flow.vet.emit.no",
    "flow.vet.emit.success",
    "flow.vet.emit.yes",
    "flow.vet.manifest.failure",
    "flow.vet.manifest.found",
    "flow.vet.parse.compile",
    "flow.vet.profile.failure",
    "flow.vet.profile.selected",
    "flow.vet.report.failure",
    "flow.vet.report.success",
    "flow.vet.request.manifest",
    "flow.vet.result.clean",
    "flow.vet.result.findings",
    "flow.vet.rules.checker",
    "flow.vet.seal.failure",
    "flow.vet.seal.success",
    "flow.vet.sources.discovered",
    "gridspec.describe.flow.accepted.select",
    "gridspec.describe.flow.audit.failure",